<?xml version="1.0"?>

<xs:schema
xmlns:xs="http://www.w3.org/2001/XMLSchema">


    <xs:element name="Inventory">

        <xs:complexType>

            <xs:sequence>


                <xs:element

                name="Product"

                minOccurs="1"

                maxOccurs="unbounded">


                    <xs:complexType>

                        <xs:sequence>


                            <xs:element
                            name="ProductID"
                            type="xs:integer"/>


                            <xs:element
                            name="Name"
                            type="xs:string"/>



                            <xs:element
                            name="Category">

                                <xs:simpleType>

                                    <xs:restriction
                                    base="xs:string">

                                        <xs:enumeration
                                        value="Electronics"/>

                                        <xs:enumeration
                                        value="Clothing"/>

                                        <xs:enumeration
                                        value="Food"/>

                                    </xs:restriction>

                                </xs:simpleType>

                            </xs:element>



                            <xs:element
                            name="Stock">

                                <xs:simpleType>

                                    <xs:restriction
                                    base="xs:integer">

                                        <xs:minInclusive
                                        value="0"/>

                                    </xs:restriction>

                                </xs:simpleType>

                            </xs:element>



                            <xs:element
                            name="Price"
                            type="xs:decimal"/>


                        </xs:sequence>

                    </xs:complexType>

                </xs:element>


            </xs:sequence>

        </xs:complexType>

    </xs:element>

</xs:schema>